City,Reviewer Name,Review Title,Positive Review,Negative Review
Sharm-ElSheikh,Ianina,exceptional choice for a beautiful relaxation,"the location of the property with an open view of the sea,the pool and pet friendliness were the criteria for choosing this property. big rooms ,clean ,good quality for sheets,towels, very good food with good prices and very kind staff are other positives for this location. i want to thank Hawary for the care and kindness offered ,he is a valuable employee to the property. snorkeling site is in front ,few steps to the sea and the pool is really big and nice.","there are details which can be easy fixed in the rooms,1 chair,black out curtains and a better maintenance,but if you are not very picky,it cant spoil your stay there compared to the positive parts. really the wifi is not covering all the areas but you can buy a phone card for internet and you are covered"
Sharm-ElSheikh,Nicola,Gorgeous peaceful place.,The view was astonishing. The staff were all really nice. It was very peaceful. The food was great!,Still some teething issues. Plumbing. The area is under major construction. The sea isn’t easy to access at all. Mosquitos are very bad here.
Sharm-ElSheikh,รื่นเริง,👍🏼,"Of course, the view was perfect nice staff, I’d met Ashraf, overall is nice the staff are well serviced. I hope those family of the black cat growing up well also 😍","Sometimes the food have less choice of the option in the Menu, for the breakfast have only 1 thing out of 3 to choose, so that’s kind of boring if you stay many day with the same menu of food. Hope you prepare it well next time!"
Sharm-ElSheikh,Jukka-pekka,Good,Desent place for The Price. Outside hotel looks nice. Staff was nice.,The hotel room's bathroom is not tidy. the sheets on the bed look dirty. there are no sheets in the blanket. Hard to get to coral reef. No jetty.
Sharm-ElSheikh,Gavin,Very Good,"near the water, quiet, nice staff. i was only there for one night but would have stayed longer if i could",curtains in the room didn't block out light very well. aircon was blowing straight onto me in bed.
Sharm-ElSheikh,Simone,I stayed only one night and wished I had stayed longer.,"Really lovely setup - right by the sea, you can just walk off the beach into a coral reef. The pool area is amazing, chilled coffee house vibes and music. The staff are so friendly and helpful, always with a smile. Breakfast was so yum and filling. I would mention that it's only cash and no atm nearby but they take a lot of currencies.",Shower was leaky.
Sharm-ElSheikh,Denise,The name Serenity Lodge is program.,"This place is pure magic💫. If you are looking for a place to relax, to snorkel in a peaceful and colorful environment or to come together with likeminded people or to talk about the universe, then you are the right place! The personnel is beyond friendly and very eager to help you in any situation possible. The owner is also very, very friendly and helpful. 

They have their own taxi drivers and even though Serenity Lodge is a bit further away from those busy areas, it's absolutely worth it. The prices are also very fair.

PS: They just built a very cool and cosy area next to the pool where you can work as a digital nomad! They even have charging stations on the pillars of the whole construction - it´s just amazing!","Id o not have any negative points, just two things I´d probably do in the near future.

I´d only put some seating furniture on the balcony, a table and two chairs for those who need to work in the room and some plants in the rooms to make it more cosy, but I think its already in the making. 

And I´d add the Egyptian Salads (Mezze) that you get in any restaurant to the menu. They are so delicious and it is really great if you don't need to go out for that (but this is just a very personal thing cause I could eat this from dust till dawn) 😁"
Sharm-ElSheikh,Siveen,Nice & quiet place for relaxation,Didnt have the chance to try the breakfast but the location is amazing .,"Security they were super rude . Unbelievabley rude . 
I had to get into a fight because one of them was so rude and wouldnt make a proper convo kept shouting till smw from my friends lied about giving the other one money so he could just leave us alone ! This is one situation of our stay ."
Sharm-ElSheikh,Amir,Exceptional,"good location ,staff are really helpful.
the best hotel to stay around naama bay ,
i would like to thank mr osama from the restaurant managment for his efforts .
i used to book and use falcon for last 11 years .",all ia good
Sharm-ElSheikh,Mohamad,Despite all the reservation manager was a very helpful gentelman.,All in all is fine for the low budget traveller.,"The price agreed with booking.com wasn’t the price I had to pay at the reception which is not correct!!
They have cashed a higher price."
Sharm-ElSheikh,Guangcong,Budget accomodation near Naama Bay,"All the staff are very kind, located walking distance to Naama Bay, at least when it's not too hot. Very economical option","The facilities are very old, staff are doing their best to maintain it, but there is just that much one can do. Standard room has window open to corridor, so one probably will have it covered most of time."
Sharm-ElSheikh,Hicham,Very Good,near to everything,all good
Sharm-ElSheikh,Ahmed,Pleasant,#NAME?,"- Food taste and varieties 

- Cleaness 

- Beach is far from the hotel, you have to walk under 50 degree temperature and the sun above your head for 12 minutes to reach the beach. I don't know why the hotel is not providing shuttle bus from hotel to beach and vice versa

- usually no available places on the beach ."
Sharm-ElSheikh,Ahmed,Pleasant,"Good value for money, the oriental coffee ahop owner is the best thing about this hotel, very hospitable and the prces are very reasonable.","Slow check in process,

Lobby was very hot
Lunch and breakfast minimal no boiled eggs no hot drinks in dinner for half board drinks are awful ... . Beach is 1km walk with no free transportation and needs to take tickets daily from reception, the beach also denies food and drink from outside.
House keeping hates Thier jobs and does it half a**ed only showed up 2 times in my 4 night stay."
Sharm-ElSheikh,Basant,"Was ok , good value","Early breakfast and dinner ! 
Dinner last at 9pm!
Although we r in summer time 
Also breakfast ends at 9: 30 Am !","Early breakfast and dinner ! 
Dinner last at 9pm!
Although we r in summer time 
Also breakfast ends at 9: 30 Am !"
Sharm-ElSheikh,Oğuzhan,Good,Thanks for be interested in Reception Mustafa and Mahmoud and King of the Stuff in there Housekeeper Mustafa very funny guy. Breakfast and dinner was good and there is in good location to everywhere.,None
Sharm-ElSheikh,Shayeb,Very Good,"Abdullrahman, Naji, Mohamad, and Mahmoud best regards from Moustafa ( 
Best people)",No Negative Review
Sharm-ElSheikh,Luke,Very Good,Everything,Ore variety of food. Longer check out time. Better plug sockets in the room and better tv.
Sharm-ElSheikh,Dancho,Great place to visit with your family,"It was my first all-inclusive stay, and I was surprised by how good it was. I was able to see the chefs how they prepare the food on the spot. A pizza guy was making the dough and baking the pizza. The fish guy, was grilling fish and sea food on the spot. And there was soo much food to chose from that it was hard.

Beach is really nearby, it has a shuffle bus, but personally I've never used it, although I was with a 4-year baby. It is really nearby. 

The room was big, and with a view to the sea. It was cleaned daily, and it had space for cloths, and other stuff.

In the lobby, it had shops, but also Taxi desk, where you can ask for personal transfer anywhere - whether it is a short travel, or day-tour

The bay is WOW - you can snorkel and see reefs and a variety of fishes. 

The pools are also fantastic - they have aquapark sliders, that we really enjoyed.","The beach is on rocks. So it is not really baby-friendly. But if you use the bay, you can immediately look at fishes. 

The prices for boat tours, and taxi travels are overpriced. We've realized this after we left, and tried other companies - it was like x2 or x3 than regular prices for tours. But this is normal in most of resorts."
Sharm-ElSheikh,Husna,Lovely location and professional staff,"The hotel is well-located and the interiors are amazing. The staff were friendly and professional. 

We had a small issue with a restaurant’s reservation but was solved by Ahmed from the front desk to accomodate our desire.",There might be a variety of food but the quality and taste need to be improved.
Sharm-ElSheikh,Naif,Exceptional,"There is no Egyptian food daily in the buffet !!
Kabab kofta its...","There is no Egyptian food daily in the buffet !!
Kabab kofta its..."
Sharm-ElSheikh,Mahmoud,"So cool vibes, nice food and fantastic pool.","It was very fantastic vacation and a cool location, I am sure we will come to V Hotel again 😍","The property charged me to pay for a damaged blanket because my child painted on it with a pen, although, I see that the blanket can be cleaned with regular detergent."
Sharm-ElSheikh,Ahmad,Exceptional,Every thing,Perfect
Sharm-ElSheikh,Christian,Exceptional,"Beautiful location, the staff are all amazing, kind, welcoming, and a credit to the resort. The food was exceptional and of a high quality. The entire resort is spotlessly clean with good facilities and well zones with chill areas in case you just want to relax and take in the beautiful views.
We very much enjoyed dinner every evening at Sea Salt with beautiful views of the bay and sea. 
As I mentioned, the staff are all amazing, and so many names to mention the list would be endless. Please pass on my thanks to your hard-working team for their hospitality and kindness. 
I will be rebooting for a future visit.",No Negative Review
Sharm-ElSheikh,Agri,I urge everyone to visit V hotel.,"Variety of entertainment tools, respective and friendly staff. You never get bored in the hotel.",No Negative Review
Sharm-ElSheikh,Ronny,Perfect,Staff are really amazing and friendly,No Negative Review
Sharm-ElSheikh,Samuel,Wonderful,Reception staff very friendly. Mr Saied al Nouby manager of restaurants very kindly. Mr Omar manager of bars very professional. Mr Mohamad Ezzat manager of Malai restaurants very generous. Plenty typs of delicious food. Nice place for snorkeling.,No Negative Review
Sharm-ElSheikh,Omenebele,Wonderful,"Alot of the staff went above and beyond to help which is so refreshing. 
Sayed in Sea Salt restaurant looked after us all week
Yosri and mohammad on reception fantastic 
Fayrouz was a life saver enabling us to check out later in the day. Overall experience has been lovely",No Negative Review
Sharm-ElSheikh,Dina,JAZ hotels really high standerd I loved to stay and feel vacation,It was wonderful vacation we enjoyed the classes and the entertainment team were motivated our day and our soul thanks everyone especially Fabio . The beach and the corals was magnificent it will stay in memory for ever.,Nothing
Sharm-ElSheikh,Julie,Great location and views,"Fantastic location
Very good beach and snorkelling 
Good pool and quiet pool if you wanted to chill out
Staff good
Our cleaner Mustafa was excellent cleaned room
every day always fresh bottles of water and clean towels.","The food could of been better
Sometimes the food was only warm and could of been a better choice 
The walk down to the beach is steep and not suitable for those with poor mobility but they do have a buggy to take people if needed.
No toilets on the beach and quite a walk up to the nearest facilities"
Sharm-ElSheikh,Weronika,Everything was perfect! Ideal vacations!,"Hotel is great! Tasty food, great atmosphere, nice views and very vice staff, especially Mostafa who took care of our room and made us stay even better. We had perfectly prepared room every day and very nice and funny surprises in our room like those at photo. The location was also perfect. Me and my friend like to walk on foot everywhere, so it was close to places we wanted to visit. Also it’s the vast location to watch both sunrises and sunsets! I won’t forget it! Thank you for very nice stay, we will remember it forever and miss this place and Mostafa!",Nothing! Everything was great
Sharm-ElSheikh,Analyn,Love it like a paradise,The ambience of the place,No Negative Review
Sharm-ElSheikh,Dean,An exceptional resort and brilliant value for money. We will definitely be coming back...but armed with extra high stren,"Location, Staff (particularly Moustafa, who cleaned our room - 4229 - each day). The pools are exceptional.","The beach was lovely, but way too crowded for us - we only went down to snorkel. Despite taking precautions, we we literally eaten alive by Mosquitos having Dinner outside the La Gazzelle restaurant - thereafter we ate inside."
Sharm-ElSheikh,Nnk,The best one is Cocktail at the main bar,"Pool, Cocktails (the main bar), sea",Foods - should be improved (not many options)
Sharm-ElSheikh,Altugh,We definetly want to come back!,"we enjoyed our stay at Jaz Fanara resort a lot the hotel was premium level, very clean, organised and professionally managed with very nice staff. The hotel has a wonderful bay and underwater for diving. food and drinks were also very good for an all inclusive concept. 
we had a misunderstanding with children accomodation policy which happened due to our wrong selection of children ages so we advice to correctly select the ages. But anyhow the hotel manager Mr.Waheed was very kind to clarify this misunderstanding and make our stay more special, we really appriciated it. And many thanks to the friendly staff. We definetly want to come back!",No Negative Review
Sharm-ElSheikh,Bettina,Diving vacation,Everything awsome! Really apprecuted there is a Padi diving center in the hotel and I was able to do my rescue padi course with a great instructor,No Negative Review
Sharm-ElSheikh,Samuel,Wonderful,"Everything very good especially the reception staff. Mr walid , Tarek & Steven , was very friendly. Nice peach. Delicious food.",Many stairs
Sharm-ElSheikh,Petya,I recommend it. It was really nice!,"We really liked it, everything was very good, very kind staff!!!",The cleaning of the room was nog amazing..
Sharm-ElSheikh,Mahmoud,"Really, it was wonderful stay. I guess ill repeat again once i could","Staff, welcoming, all facilities",No Negative Review
Sharm-ElSheikh,Maria,Great to relax,"Very spacious, lots of pools and the heater ones were really warm. Food was very good with a good variety between international and local cuisine","I am not a big fan of animation and the evening program was too loud for my taste, my toddler however enjoyed it"
Sharm-ElSheikh,Thomas,Nice,We liked the resort. We felt it was really beautifully laid-out and it had a very pleasant relaxed and friendly atmosphere. The staff were very friendly.,"The Wi-Fi was rubbish. I am not sure how it got that score. I partner paid $20 for the 72 hour internet upgrade but that was also wank. The food and drinks weren't amazing. They were fine, but they didn't match the opulence of the resort on the whole."
Sharm-ElSheikh,Isra,Real luxury all under one cleopatra roof,"Excellent staff - friendly and respectful. From the concierge to receptionists, housekeeping to taxi service, bartenders to waitress waiters and the man in charge of the shisha - one word….. exceptional!!! 

Loved our stay and will definitely be back",No Negative Review
Sharm-ElSheikh,Lyons,"Amazing place, facilties and lovely staff","The staff couldn't do enough for us, very friendly and worked so hard to ensure we had a great stay. The facilties were amazing, especially the infinity pool and the beach.",The food and entertainment were average (standard all inclusive). Prepare for an upset stomach.
Sharm-ElSheikh,Oluwole,I had a great time and would return to the Adults Only hotel which is what I thought I booked,Everything apart from internet connection in the rooms,Internet connection in the rooms
Sharm-ElSheikh,Maksim,We had a great experience,Good,"Pool, stuff and animators"
Sharm-ElSheikh,Hadj,"Excellent service , friendly reception staff","Excellent service , friendly reception staff 
Thank you everyone, hotel very nice.",No Negative Review
Sharm-ElSheikh,Valentina,Excellent stay,"everything good
reception team very helpful",No Negative Review
Sharm-ElSheikh,Berkin,Sunny delightful and flawless,From the beginning to end of our holiday everything is perfect and the staff is very helpful. The sea is just perfect and foods are delicious and grill area is delicious. Pools and room are clean and everyday Ahmad is helped. Mohammed and Shokry from Reception helped a lot for small issues.,Nothing you can choose the hotel
Sharm-ElSheikh,David,"Fab stay, fab food amazing","It’s my second home absolutely amazing staff totally from top to bottom, excellent with my husband so helpful as he has dementia they all care so much nothing is to much trouble .",I love every thing
Sharm-ElSheikh,Miss,"Cheap and cheerful, good friendly staff",Location,"Food wasn’t very varied and mostly served cold , entertainment wasn’t great , and only played music in morning round pool not in afternoon"
Sharm-ElSheikh,Andrei,Good value for money,"Food was cool, staff were very helpful","The swimming pool was about 22C which is cold, wifi works slow"
Sharm-ElSheikh,Andrii,Very Good,Good enough for the price paid,Cleanliness
Sharm-ElSheikh,Lukasz,Friendly staff and decent value for small money,"Staff was friendly. Room was ok although you could close the main doors while doors from the ground floor balcony were not closing so room could be left open as well. Waiters in the restaurant were super helpful and friendly. 

Room size and bed were ok. Bathroom, towels were clean to decent degree. 

Restaurant offered vast selection of meals while not very tasty. 

All in all , whole men staff was trying to do their best while I reckon men's way of cleaning is not the premium.



But much much better than other 4☆☆☆☆ hotel with low price (Sharm Cliff Hotel) which was purely disaster. 

By comparison Falcon Hills is much better.","All meals feeled the same for few days. 
Distant location to any bigger shoping area. 
Checkin kind of too long and detailed."
Sharm-ElSheikh,Enrico,Good,"Very nicely maintained resort with two swimming pools, the rooms are clean and quite big. Good quality-price ratio.",The food at the bouffet is not the best and the wifi is really bad in the rooms.
Sharm-ElSheikh,Mario,Good,Staff reception,Staff reception
Sharm-ElSheikh,Amr,Good Value,#NAME?,- Shouting and screaming of the children .
Sharm-ElSheikh,Oya,Good,i always stay that hotel.Kind staff and good price,aircondition is not work proparly and cleaning is a bite weak.
Sharm-ElSheikh,Kian,Overall a pleasant stay,"・Garden/pool view from the room
・Overall cleanliness of the bed and bathroom.
・Affordable in-house laundry service 
・Friendly and helpful front desk personnel","・Hot water wasn't available most of the time
・2 glasses were provided but there's no tea spoon & kettle in the room
・The ceiling light in the bathroom was really dark
・Very limited buffet breakfast menu. Nearly half of the pastries are sugarcoated 
・WiFi wasn't reliable most of the time
・Could literally hear the showering and flushing noise from next door (due to the connecting door?)
・Room interior reminds me of the 80's or 90's design"
Alexandria,Doha,Exceptional,Everything was great special thanks to basama front desk Asma hair dresser and vale guys who always helped me but unfortunately I don’t their name hope to come back,Nothing
Alexandria,Shaymaa,It is ok but over priced.,"Location is so good at the center of the town.
Breakfast was ok. They need to pay some attention to the cleanness of the restaurant.
It is extremely over priced compared to other 5 star hotels. Valet parking was 100 EGP per night which is weird to be charged for your car per night in such a hotel.","The cleanness of the restaurant. 
The valet parking fees.
The shampoo they had was terrible."
Alexandria,Ashraf,Good,ALL,Late of arrival of bags
Alexandria,Ahmed,Good time and excellent food. Great value for money.,"Food is great, the location is central the view is wonderful.",Some of the furniture is not maintained properly.
Alexandria,Dalia,Very Good,"I had a great stay! The room was very clean, and the location was perfect, giving easy access to all areas in the center of Alexandria. The breakfast was delightful with a lot of variety, ensuring there was something for everyone. Highly recommended",No Negative Review
Alexandria,Ahmed,Good,Staff is very helpful and pleasant,Poor breakfast
Alexandria,Abdelfattah,Max three stars rating,"Three stars maximum rate is what it really worth
Good location 
Average breakfast
Comfy bed
Furniture over used
Cleanliness less than average",No Negative Review
Alexandria,Mario,Very Good,"*Location
*Fast check-in
*Responding to requests quickly",*Room cleanliness could be better
Alexandria,Mohamed,Perfect,Location and staff specially Sara Mounier at the reception,Room facilities
Alexandria,Nasser,Very Good,I had a lovely stay for two nights. I would also like to thank the two amazing housekeeping staff (Awad & Mustafa) for their wonderful hospitality.,Nothing. The hotel needs to start its renovation to continue offering the same services in the future.
Alexandria,Jiri,Exceptional,"Great helpful staff, very good breakfast with great selection. The hotel has its own beach.","Cleanliness. Everything was dirty (floor in the room, forks and spoons at the breakfast room, plates etc.). They are probably trying their best, but this is the main thing to improve."
Alexandria,Hossam,Pleasant,The view is amazing. Breakfast food was outstanding. TV is ok.,The rooms have no carpet.
Alexandria,Mai,Pleasant,"the suits are clean but require a little maintenance, the windows should be changed to a window that doesn't permit sound or air.","the suit was clean, beds were clean, also the breakfast is nice"
Alexandria,Islam,Pleasant,View,"Cleaness, noises"
Alexandria,Mina,Pleasant,Good value for money,"Cleanliness is an issue, specially it won't cost much to make the place clean"
Alexandria,Ahmed,Good,Good breakfast and good staff,The beach is so small and crowded and the parking area is so far from the hotel and the hotel without swimming pool
Alexandria,Karim,Very Good,"the location, the view, the facilities","breakfast was not as expected, the staff was not friendly as expected"
Alexandria,Aql,Pleasant,"house keeping way of cleaning such as no enough towels , did not clean balcony , one person to clean bedroom, bathroom and change bed covers
room clerck not professional 
added 25 dollars more to room rate as booked though dollar did not go up","house keeping way of cleaning such as no enough towels , did not clean balcony , one person to clean bedroom, bathroom and change bed covers
room clerck not professional 
added 25 dollars more to room rate as booked though dollar did not go up"
Alexandria,Ahmed,Pleasant,The room wasn't clean,The room wasn't clean
Alexandria,Walid,Pleasant,"Staff are very freindly, Very Good Location, Free Parking, Beds are good.","We took a 2 Bedroom Junior Suite, The room were good but the shower in the bathroom always flod the bathroom every time any one take a shower.

The Free Internet is nightmare. very slow and the coverage in rooms are very bad. No wired internet. Also the Mobile Network are very week in this hotel (All Networks)."
Alexandria,Sahar,Excellent,Very clean friendly staff amazing sea view,Nothing
Alexandria,Rasha,Decent place but needs renovation,Location & view,"Bed mattress & sheets need renovation 
Breakfast food refilling"
Alexandria,Said,It was convenient for me but I will not stay again.,I liked the view and that I have been upgraded to a suite,"The beds were too small abd very hard sorry to say that beds were not comfy, the breakfast buffet very poor."
Alexandria,Enjy,Very Good,Location,The bathroom door is glass and you can see inside which is not suitable
Alexandria,Mariam,Pleasant,Location and stuff are very nice. Stuff is friendly and service is good.,Hotel wifi is bad even signal is bad. Also they don’t allow food or drinks from outside to force us buy from them.
Alexandria,Riham,Lovely view,Location and view. The staff are helpful. It’s ok for the price,The shower is outdated and was broken. Breakfast was not the best
Alexandria,Hakam,Very Good,Great view,Aircondition is weak
Alexandria,Sümeyye,Pleasant,There was a lady with a singer name I guess it was Madonna but ım not sure she was the only one who helped me,They accepted my early check in through app but when I arrived there they charged me with extra money. If you don’t know Arabic conversation might be difficult for you.
Alexandria,Bera,Very Good,"Location is wonderful, room balcony just towards beautiful medetaranian sea and lot of restaurants and shops around the hotel. Tram Station also within 5 min walking distance. Breakfast was decent and can be considered as value for the money.",No Negative Review
Alexandria,Hawfan,Value for money with beautiful location,Location and view,No Negative Review
