City,Reviewer Name,Review Title,Positive Review,Negative Review
Sharm-ElSheikh,Andrea,Perfect from start to finish. Wonderful place.,"An absolute diamond of an apartment. Everything was perfect from start to finish.

Mounir the host is wonderful. Answering all my questions. Super polite and helped me out loads.

Ahmed the taxi driver was great also. Please ask Mounir for his details for airport pick up/ drop off.

The location is perfect. In a calm, peaceful and beautiful residential area which is near to everything you will need.

5 minute walk away you have the beach and beautiful beach clubs/ bars. Such as the very famous and pretty Farsha Cafe (to note that only women, couples and families are permitted) Santorini with its Greek Island blue and white them and beautiful decor/ views…and my favorite “Temple Beach” (only 100 EP for the whole day. Lounger/ Umbrella/ Towel and toilet/ shower facilities plus bar and the most friendly polite staff. Gorgeous clean beach for sunbathing/ swimming/ snorkelling…Open from about Sunrise to Sunset and allows solo travellers.

5 minute walk in the opposite direction you have a shopping/ eating area built around the “Dahab Centre” loads of mini supermarkets mainly open 24 hours. Tobacco/Cigarette shop 24 hours (a 20 pack costs about 120 ep so about £1.50) different alcohol shops like “Drinkies” and others (a big can of delicious local beer Stella is around 50 ep). You then have the “Enab Restaurant”. Beautiful decor with a water feature and ambience. Wonderful food (I ate here everyday of my stay) and amazing prices.

The apartment is super clean and very comfortable. You have privacy and it is very secure with lock to gate and front door plus very safe family friendly quite residential area. You have a comfortable double bed which can be separated to 2 singles if needed. L shaped sofa plus wifi, kitchen area with all cooking/ utensils, huge fridge. Bathroom with shower (great water pressure and always warm water when needed). Also has a wall fan and a separate air con all with remote control.",N/A….Everything was wonderful. No faults at all.
Sharm-ElSheikh,Ulaş,"Amazing, worth money","They allowed us to check in earlier than normal check in time and arranged a new room for us. Their open buffet breakfast is beyond perfect. They saw that we were tired and offered us a free open buffet lunch, they were very kind.",wifi not available in room
Sharm-ElSheikh,Mark,Friendly clean happy resort,"There are so many things to like about the Dive Inn Resort. From the moment you check in Costa and the entertainment crews, the waiting staff, the bar guys, the pool guys, the drivers, chefs, in fact everyone always have a friendly smile and eager to ensure you have a pleasant stay. You wont go hungry here with a good selection of food, including a new outside grill and pizza area . Plenty of room around the pool with the addition of a new outside jacuzzi. Rooms are clean, spacious and functional. Shop and gift shop on site selling holiday essentials, tshirts, shorts, gifts etc. Plenty of trips and excursions available for sightseeing, diving etc and a free bus to local beaches. Can book a car or taxi in the lobby if you need to get into town, airport or further afield. Wifi is free and good if you need to keep connected. All in all a friendly, clean, safe place to stay at a good price.",No Negative Review
Sharm-ElSheikh,Hassan,Wonderful,"Costa man is the man has the best smiling on the hotel so nice..friendly..helpfull 
So when you get there ask about ahamed costa
Others staff are very good too",Taxi..
Sharm-ElSheikh,Robert,Very Good,"Good budget hotel I always choose when I'm diving with Circle Divers (best dive base in Sharm for experienced divers, just a five minute walk away) - clean, relatively quiet, cheap and I didn't get diarrhoea from the breakfast... Good enough for me",No Negative Review
Sharm-ElSheikh,Rachelle-jean,The staff make this place great!,"Had a lovely stay at Dive Inn resort! Staying here exceeded my expectations and the reason for this is the staff. They are incredibly friendly and very hardworking. The welcoming feeling they gave me, made me feel right at home upon arrival. Had some really nice evenings relaxing at the bar and the bar team was amazing. Thank you Amr for making sure my glass was always full of beer, haha. They are funny but also make sure that you are okay throughout the evening. Costa went out of his way to make me feel comfortable and that everything was good in my room! And Said the lifeguard at the pool is very funny. The room was comfortable, the food was good and I liked the location because it was close to the dive center I was diving with, but honestly the staff are what make this place good. They create a lovely atmosphere and for this reason I will definitely come back here if I visit Sharm el-Sheikh again! Thanks guys 😊",all was good
Sharm-ElSheikh,Sudhir,"Decent location, value for money","Nice property, with a huge pool",Rooms appear a little worn down.. can use refurbishment.
Sharm-ElSheikh,Nurunnabi,Wonderful,"The receiptionist Costa. Super guy, he did more than we asked",No Negative Review
Sharm-ElSheikh,Ilhan,Very Good,everything was good enough.,No Negative Review
Sharm-ElSheikh,John,Great first stay will use again.,Breakfast usual fare but as much as you wanted.div3d with Circle divers just 5 minutes walk up the road.,Stayed bed and breakfast lack of local restraunts
Sharm-ElSheikh,Zilehumajawed,Wonderful,Spa,Room size
Sharm-ElSheikh,Naif,Exceptional,"The Hotel is amazing and clean and room are spaceious the staff are super friendly specially Ahmed Galal the resipation managrr he is professional it was a wonderful stay certinaly will come back again
 

 Thank you Cleopatra Luxury Resort Sharm El Sheikh team 🌹",..
Sharm-ElSheikh,Damilola,Amazing,"Everything, the staffs, facilities, location etc.","Food could've been a lot better, having heated pool would have also been better."
Sharm-ElSheikh,Ramin,Amazing,Very nice hotel nice staff especially Mr. Alferd and Mr. Ahmed khalaf from the front desk and Mr. Ahmed Fouad from Housekeeping we enjoyed our stay,No Negative Review
Sharm-ElSheikh,Maksym,Thanks Cleopatra we will be back,Very cool And very nice hotel we are looking to back again soon everyone is helpful especially Mr. Ahmed khalaf at the front desk very professional,nothing mentioned
Sharm-ElSheikh,Rob,A worthwhile stay,"convient location, really helpful front office staff and good food",Nothing really to complain about
Sharm-ElSheikh,Sophie,Amazing,"Everything, the staff were all so friendly and always asking us if there was anything we needed, the rooms were clean, we booked the swim up room which I completely recommend it was amazing! Food was nice, we were always being offered a drink, haven’t got a bad word to say!",No Negative Review
Sharm-ElSheikh,Imran,Amazing,We like all staff Especially Mr. Ahmed Khalaf from the front office the food also was very nice,Nothing
Sharm-ElSheikh,Umar,Lovely,Nice environment would came back any time nice staff especially Ahmed Khalaf from front office Thank you for everything,No Negative Review
Sharm-ElSheikh,Umar,Amazing,"We had the best holiday at Cleopatra Luxury Resort! The experience was amazing, and the staff, especially Ahmed Khalaf and Alferd Sobhy, were exceptional. We would love to come back!",Nothing
Sharm-ElSheikh,Jina,Memorable Trip!,Great service and friendly staff! Everyone was so helpful and just nice people. We have enjoyed our time here and would definitely visit Sharm El Sheikh.,It’s a shame that the pools weren’t heated as I would have liked to spend more time in the pool and the entertainment could be better with music / and activities.
Sharm-ElSheikh,Esraa,"Over all, our stay was so great and we had so much fun with alot of great and helpful people.","Everything was perfect. I want to thank all the employees starting from the reception Mr.Ahmed Mansour and Mr.Essam who tried their best to make our accommodation very comfortable!!
Also, special thanks to the animation team( Shika, Sonic, Zoly, Asel), they are the best animators ever and I hope to see them again!!♥️
The food was in good quality and large variety!!
The pools were always clean and working , Also the bars on the pools and the beach were amazing with very beautiful reefs!!
I am sure that I will repeat this experience again 🙏🏻","- Old furniture at our room.
- the all inclusive bar is closing at 12 a.m and it is early for us."
Sharm-ElSheikh,Troqi,Exceptional,Thank you mansour and saleh for everything,No Negative Review
Sharm-ElSheikh,Mohamad,Exceptional,The hotel is very nice big thanks to the reception team Ahmed Salah and Mansoor.Kareem.and Thanks you too much.,No Negative Review
Sharm-ElSheikh,Andrii,Very Good,Exceptional sea view. Location close to everything. Responsive and helpful staff at the reception. We stayed in a nice renovated room with good soundproofing. Not bad kitchen. Good housekeeping and room cleaning.,"No warm pool. Some of the staff is rude, especially barmens. There was ongoing construction renovation of pools next to our stay, but good soundproofing saved us from unconviniences."
Sharm-ElSheikh,Alaa,Best hotels in Sharm,"The hotel is very big you can't get bored at all. 
There are many swimming pools and areas to relax so everyday we used a different place to chill. The beach side was very nice and lots of activities to do for everyone. 
They also have a small playground area for children near the beach. 
We stayed in the room 131 and thar was perfect in the middle of the resort. Each swimming pool section has different cousine.

The staff members were beyond great and helpful. 
Especial thank you to Ahmad almansour. He helped us in every way and explained everything so well. 

I have lost my necklace and panicked and told him he sent staff members to search for it and thank God they found it. 

It was our first time here and we already booking a trip back in april/may",Nothing
Sharm-ElSheikh,Will,Exceptional,Helpful and friendly reception staff. Large recently renovated room with a sea view.,No Negative Review
Sharm-ElSheikh,Mohamad,Exceptional,All,No Negative Review
Sharm-ElSheikh,Rodrigue,Exceptional,Everything was awesome,No Negative Review
Sharm-ElSheikh,Tamer,It was amazing,"The best hotel ever, everyone doing more than his best to please us , they’re always smiling and helpful their hospitality reaches the top. Thanks for everyone at that wonderful place.",Nothing at all
Sharm-ElSheikh,Uzgel,Overall recommended,"I really enjoyed our stay at this hotel. Our renovated room was cozy, comfortable, and offered a stunning sea view. The food was enjoyable, and the private beach with its reef provided an unforgettable experience for us. If I were to visit Sharm again, I would choose this hotel without hesitation.

Given the number of Turkish guests at the hotel, having Turkish-speaking staff would be nice. Nonetheless, the staff was very helpful. A special thanks to Roma for organizing our transfers to the city center, the old town, and the airport—his service was seamless and the drivers were friendly and proficient in English.

I particularly enjoyed the à la carte restaurants, especially the Lebanese restaurant, although I found its name, “Mandarine,” a bit puzzling.

Overall, I would definitely recommend this hotel, if you don’t mind a few minor inconveniences.","there are areas for improvement. The provided amenities were insufficient and of poor quality, so I recommend bringing your own toiletries for your comfort. Additionally, the absence of free Wi-Fi is a significant drawback for a five-star hotel—you have to pay for internet access."
Sharm-ElSheikh,Jankov,Exceptional,The hotel is situated at the beach with beautiful coral reef. Facilities as expected for a 5* hotel.,No Negative Review
Sharm-ElSheikh,Sharon,Good,"Snorkling in the corals on this beach
Good selection of food
The complex and swimming pools","Only allowed to use one bar and it was awful, no oxygen, dark and dingy, badly decorated and a cattle market of people.
The other 2 bars you had to be ultra all inclusive to use, one was dark and dingy the other nice but no one was in them. Everyone would fit in all 3 bar areas people need variety."
Sharm-ElSheikh,Ahmed,Very Good,"Management response are agile & very responsive, staff are nice & helpful, beach are very safe, food is very clean & tasty",The facility needs some minor renovation on outdoor areas for example some walkways
Sharm-ElSheikh,Kigen,The stay was okay. Friendly staff,Nice scenery,Unstable wifi and the food wasn’t good
Sharm-ElSheikh,Mohamed,Wonderful,انصح به,"Blackout is very weak and the room is lit in the morning, I can't sleep"
Sharm-ElSheikh,Malin,We had a lovely week!,"The food , the drinks, the snorkling, the reef, the slides, the apartment, we had a great time!","No WiFi in the apartments but good in the lobby and at the stage, pool area at the beach and restaurant"
Sharm-ElSheikh,Omer,Very Good,"Excellent room design, nice garden, clean and modern bathroom and building. 10/10 rooms
Also I admired the beach beds and umbrellas. Bravo
Middle garden was breathtaking","Food and wifi. Honestly such a great building should have been complete with food and wifi. Waiters can be nicer and kinder as well.
Wifi is quite limited on rooms and restaurants, it was such a low speed which can only afford WhatsApp texting. If you have a picture that takes 50kb it takes several minutes to download. 
and on the beach no wifi at all."
Sharm-ElSheikh,Takafumi,Good,"When I faced a trouble, Ahmed Ismail, who is front office manager, helped me and solved the problem! Appreciate him.",Wi-fi was really weak and it was not improved even when I asked the front desk. There's no bath robe in the room. Key was not working properly sometime. The room was so far from the front desk and sometimes you lost your way.
Sharm-ElSheikh,Suha,Wonderful,"Location 
View","Food was very bad 
Needs to re-visit kitchen staff
Food quality was bad"
Sharm-ElSheikh,Andreea,Not 5 * hotel!!,"The beach is small but very nice, suitable for children or people that can't swim. The employees trying their best to solve the issues. The minibar filled every day with water, small boxes of juice and waffers.Bed sheets changed 2 times in 7 days","Long lines of people on beach bar, long time of waiting for a car ( 3 cars only for a big resort), mosquitoes in the rooms, the quality of food( most cheap ingredients, cheese, salami...), coffee is a cheap brand of Nescafe, juices are Tang mixed with water, no bathrobe or slippers, clogged pipes for showers, lack of employees, Panorama bar is not inclusive"
Sharm-ElSheikh,Nadine,Ultimately MY FAVORITE SPOT at Sharm! Thanks a lot Tivoli for hosting me so professionally and kind,"Always an exceptional outstanding experience at Tivoli.. there are too many luxurious hotels at Sharm, but by far, Tivoli Resort was the most hospitable to me on a personal level. it's my ""Spot"" now !! Thanks again Tivoli for the good hosting and the great food !",No Negative Review
Sharm-ElSheikh,Youssef,Comfortable hotel,"Location very comfortable 
hotel very quite",No Negative Review
Sharm-ElSheikh,Maria,Exceptional,"My stay in Tivoli was fantastic! Another hotel cancelled on me at the last minute and they welcomed me in a beautiful way. They accompanied me at all times. I would like to thank all the kitchen and cleaning staff, but especially Mousa and Rafat, they made me feel at home.",No Negative Review
Sharm-ElSheikh,Mostafa,Nice treatment,Thank you for all and will amend very nice treatment,No Negative Review
Sharm-ElSheikh,Nadine,Thank you Tivoli for always surprising me with the best service ❤️❤️❤️❤️❤️,"I loved the food, the service, ALL the staff was profeSional. Hotel is super clean and everybody was super nice! My favorite spot in sharm ❤️",No Negative Review
Sharm-ElSheikh,Qiang,very good place,very good place,No Negative Review
Sharm-ElSheikh,Nadine,My FAVORITE spot in town ❤️❤️❤️,"Cleanliness , food and the most professional staff ❤️❤️",No Negative Review
Sharm-ElSheikh,Mohammed,Very Good,Staff are good,No Negative Review
Sharm-ElSheikh,Hamid,VERY KIND TEAM,"THANKS FOR ALL SERVICE
VERY NICE WHEN I WAS SICK EVERYBODY HELPT ME AND CALL DOCTOR AND BRING FOR ME FOOD
THANK YOU AGAIN SPECIALLY MR.MOUSA",No Negative Review
Sharm-ElSheikh,Nadine,By far the BEST experience I had in sharm . Thank you tivoli,"Beautiful experience !! It will be my zone in Sharm :)
The staff was alll very lovely and inviting and kind. Everybody was exceptional they made it feel like home.
Everybody should try the hotel. Thank you Tivoli sharm",No Negative Review
Sharm-ElSheikh,Salem,Exceptional,Ibram and esmtt they are the best,No Negative Review
Sharm-ElSheikh,Ahmed,Exceptional,"I would like to thank Jaz Belvedere staff for their great hospitality. 
Special Thanks goes ti Mr Esmat how follow up with us prior to our travel and also he offer a complementry upgrade for our room to a very special family room.
The resort is wonderful and very clean you will find everywhere the staff is trying to help and offer support.
The food quality and variety is great.
Thanks Jaz Belvedere team for making our trip great and un forgetable.
Wish to come again",I would like to add one improvement point the pool need to be heated more to coup with the temp decrease so the guest can enjoy the pool as the sea was veru cold
Sharm-ElSheikh,Tadić,Amazing,Everyone is nice. Everything is clean,No Negative Review
Sharm-ElSheikh,Vlad,Exceptional,"Very nice hotel,
Staff is amazing 
We will come back",No Negative Review
Sharm-ElSheikh,Mudia,No Title,This review is hidden because it doesn't meet our guidelines.,No Negative Review
Sharm-ElSheikh,Mudia,.,.,.
Sharm-ElSheikh,Maksim,Wonderful,The whole hotel territory is very well maintained. The room was good and clean. The staff is very friendly and really willing to help. Appreciate help from Esmat.,"In case of any questions, ask help from reception."
Sharm-ElSheikh,Tırnavalı,Like heaven…,"Food was great, sea was fantastic. The fish under the water was amazing…",Nothing :)
Sharm-ElSheikh,Khaled,Exceptional,"staff, restaurant, pool and sea",No Negative Review
Sharm-ElSheikh,Philip,Fantastic,"Rooms are fantastic always clean everywhere, staff are all polite and extremely helpful. Couldn’t be more willing to do anything for you. Good food choices all day",All good not applicable
Sharm-ElSheikh,Olga,Exceptional,"This resort is amazing,very friendly staff,especially animation team ,they were great ,so welcoming and full of joy and positive mood.Complete day full of activities to enjoy.Hetel is very clean and well arranged.Food was delicious and many varieties.We had wonderful time and definitely will visit this resort again with great pleasure. Thank you so much Jaz Mirabel, general manager Mr. Ibrahim and the whole team.","All was great,nothing to complain about."
Sharm-ElSheikh,Yara,Wonderful,Thank you so much Mohammed Abdelstar for your warm welcome and excellent service. You’ve made our stay truly memorable.,No Negative Review
Sharm-ElSheikh,Yasser,It was marvelous wish to go back,"The staff were so welcoming and friendly
The food was excellent and diverse
The room was excellent regarding area and cleanliness",The beach was not suitable for access to sea swimming
Sharm-ElSheikh,Ian,Excellent for families and couples,The staff and service was excellent,Nothing
Sharm-ElSheikh,Mohamed,Lovely stay,"Perfect satay receptionist Abdullah and Mr Khalid very kind and co operative 
Also shif Attia very kind and very co operative",Hmmmm
Sharm-ElSheikh,Anastasiia,In short: it was our first time in Egypt and this Hotel brought a lot of joy and good memories!,"Excellent staff! Receptionist team during our stay 4th-11th of November were incredibly helpful, kind, and welcoming throughout our visit. The hotel itself is very big and divided on 3 parts which gives more space for everyone and doesn't make human interaction with each other to tight. Restaurant was very good, a big variety of food every evening and staff there created an unforgettable experience! Room was spacious and comfortable! The seaside area was expansive, with ample space for everyone to enjoy. We loved diving right from our beach to see the sunken boat—a real highlight!The DJ set on the Hotels Disco night was awesome! Definitely will return next time!","The lock on our room door was old and didn't always work properly. However, the animation program could use some improvement. While the staff were friendly, the overall program felt weak, with limited options for activities. We’re hoping to see a more engaging and varied program on our next visit!"
Sharm-ElSheikh,Ali,"Amazing Hotel, had a very enjoyable memorable stay","Checkin checkout was very smooth, staff are always available there to help you with a smile, food and hotel facilities are amazing",Snorkeling spot is a long walk from the beach
Sharm-ElSheikh,Ramy,Flawless,"Spotless clean with expansive, well-maintained green areas, this resort offers a truly welcoming atmosphere with friendly, attentive staff. It features a variety of restaurants serving delicious food of excellent quality, spacious rooms, and an amazing beach perfect for swimming and snorkeling. The multiple pools, including heated ones, are a great touch, and the nightly entertainment is enjoyable. Rooms are well-equipped with convenient amenities, WiFi is available throughout the property, and ample parking is provided.

Highly recommended for anyone looking to relax and unwind.

A special thanks to Ramadan from the main restaurant for his dedication and exceptional care.",Nothing at all.
Sharm-ElSheikh,Aziz,Exceptional,It was more than wonderful an for sure i will go there again soon and there was at reception Abdullah Khaled it was very helpful and cooperative and supportive and wish all the staff will be same as Abdullah,Absolutely nothing
Sharm-ElSheikh,Salar,Great well-rounder,"• Very very clean
• Food is surprisingly good and restaurants open exactly on time
• The staff are very nice
• The view is great",No complains
Sharm-ElSheikh,Patrícia,Exciting to visit again,"We will definitely come back again, great hotel. Beautiful reception and very attentive to your requests. The rooms are beautiful and with a distinctive view. The food is good with delicious and delicious food. We enjoyed the water games. It was a great vacation",No Negative Review
Sharm-ElSheikh,Mandy,The staff was brilliant and well accommodating. They ensured I was happy every step of the way. The manager was very fri,It was a lot of a space and well organised,I like everything I’m well satisfied
Sharm-ElSheikh,מיכאל,Exceptional,We have like the staff and cleaning. There are was a lot of places to get a drink and snacks. As well we appreciate for personal assistance to manager Ahmed Mostafa,Small variations of food especially salads and side dishes
Sharm-ElSheikh,Bashir,Excellent stay. Will come again.,"Everything, was good. 
I have been here many times and they gave late checkout for free. 

Room service was brilliant. Abdelmoneim was excellent. 

Mostafa manager was brilliant",N/a
Sharm-ElSheikh,Predrag,Excelent vacation,Everything,No Negative Review
Sharm-ElSheikh,Serghei,Exceptional,All was perfect.good service.highly reomand!rrception guys were very polity and nice.Big respect to AHMED menedger..The best!!!,No Negative Review
Sharm-ElSheikh,Ken,Exceptional,Perfect hotel for families with small children.,No Negative Review
Sharm-ElSheikh,Murat,Amazing experience of family holiday,"Exceptional service from the very start till the very finish of our stay. Staff was very friendly and helpful, especially Ahmed Mostafa from reception desk. We got early check in and update of booked room type without any charge which was absolutely fantastic touch after the night flight.

Hotel has huge beautiful and very maintained territory. Our room was very clean, and housekeeper Mohammed always managed to clean it when we were out.

Aquapark is awesome, our kids enjoyed it a lot. Great variety of pools and slides suitable for each age, so easy to find perfect ones for kids of any age. 

Service in restaurants was also great. Restaurants were clean and neat which was very important for us.",Children animation might be a little bit more professional.
Sharm-ElSheikh,Dmitrijs,Outstanding!,"We enjoyed every minute of our stay, hotel exceeded our expectations. Spacious room, outstanding service, mountains of water slides and plenty of attractions for kids and parents, evening shows...You can find everything you need for a perfect vacation here! Definately booking same hotel next time in Egypt!
Many thanks for reception staff and Ahmed Mostafa in particular who helped us any time and made our trip even greater! Also many thanks to Mr Abdul who provided spotless cleaning every day!",No Negative Review
Sharm-ElSheikh,Muhammet,Exceptional,Reception and all services are fabolous. Special Thanks to Mr.Ahmed hotel manager for his great hospitality.,Nothing at all
Sharm-ElSheikh,Andreas,Exceptional stat,Best place we stayed. Breakfast by pool and beach. Corals. Spacious room,Maybe little be far from center but that was not priority. It was actually benefit for us.
Sharm-ElSheikh,Dorolisso,Very Good,"The room was really spacious, 
Quite area , nice views
And warm welcome at the reception",No kettle and glasses in the room
